datasetID,accessible,institution,dataStructure,cdm_data_type,class,title,minLongitude (degrees_east),maxLongitude (degrees_east),longitudeSpacing (degrees_east),minLatitude (degrees_north),maxLatitude (degrees_north),latitudeSpacing (degrees_north),minAltitude (m),maxAltitude (m),minTime (UTC),maxTime (UTC),timeSpacing (seconds),griddap,subset,tabledap,MakeAGraph,sos,wcs,wms,files,fgdc,iso19115,metadata,sourceUrl,infoUrl,rss,email,testOutOfDate,outOfDate,summary
allDatasets,public,Ifremer,table,Other,EDDTableFromAllDatasets,* The List of All Active Datasets in this ERDDAP *,,,,,,,,,,,,,https://erddap.ifremer.fr/erddap/tabledap/allDatasets.subset,https://erddap.ifremer.fr/erddap/tabledap/allDatasets,https://erddap.ifremer.fr/erddap/tabledap/allDatasets.graph,,,,,,,https://erddap.ifremer.fr/erddap/info/allDatasets/index,https://erddap.ifremer.fr/erddap,https://erddap.ifremer.fr/erddap,https://erddap.ifremer.fr/erddap/rss/allDatasets.rss,https://erddap.ifremer.fr/erddap/subscriptions/add.html?datasetID=allDatasets&showErrors=false&email=,,,This dataset is a table which has a row of information for each dataset currently active in this ERDDAP.
OACP-Argo-Global,public,LOPS/Ifremer,grid,Grid,EDDGridFromNcFiles,2000-2015 climatology of the Subtropical Mode Waters and Permanent Pycnocline properties in the World Ocean,-242.156,129.844,1.0,-61.642,64.358,1.0,,,,,,https://erddap.ifremer.fr/erddap/griddap/OACP-Argo-Global,,,https://erddap.ifremer.fr/erddap/griddap/OACP-Argo-Global.graph,,,https://erddap.ifremer.fr/erddap/wms/OACP-Argo-Global/request,,https://erddap.ifremer.fr/erddap/metadata/fgdc/xml/OACP-Argo-Global_fgdc.xml,https://erddap.ifremer.fr/erddap/metadata/iso19115/xml/OACP-Argo-Global_iso19115.xml,https://erddap.ifremer.fr/erddap/info/OACP-Argo-Global/index,(local files),https://doi.org/10.17882/56503,https://erddap.ifremer.fr/erddap/rss/OACP-Argo-Global.rss,https://erddap.ifremer.fr/erddap/subscriptions/add.html?datasetID=OACP-Argo-Global&showErrors=false&email=,,,Maps of properties from OAC-P estimates. Thermohaline computing using gsw oceanographic toolbox
ArgoFloats,public,Argo,table,TrajectoryProfile,EDDTableFromMultidimNcFiles,Argo Float Measurements,-179.99942,180.0,,-99.999,89.97058333333334,,,,1997-07-28T20:26:20Z,2026-12-27T14:48:20Z,,,,https://erddap.ifremer.fr/erddap/tabledap/ArgoFloats,https://erddap.ifremer.fr/erddap/tabledap/ArgoFloats.graph,,,,,https://erddap.ifremer.fr/erddap/metadata/fgdc/xml/ArgoFloats_fgdc.xml,https://erddap.ifremer.fr/erddap/metadata/iso19115/xml/ArgoFloats_iso19115.xml,https://erddap.ifremer.fr/erddap/info/ArgoFloats/index,(local files),https://argo.ucsd.edu/,https://erddap.ifremer.fr/erddap/rss/ArgoFloats.rss,https://erddap.ifremer.fr/erddap/subscriptions/add.html?datasetID=ArgoFloats&showErrors=false&email=,,,"Argo float vertical profiles from Coriolis Global Data Assembly Centres\n(GDAC). Argo is an international collaboration that collects high-quality\ntemperature and salinity profiles from the upper 2000m of the ice-free\nglobal ocean and currents from intermediate depths. The data come from\nbattery-powered autonomous floats that spend most of their life drifting\nat depth where they are stabilised by being neutrally buoyant at the\n""parking depth"" pressure by having a density equal to the ambient pressure\nand a compressibility that is less than that of sea water. At present there\nare several models of profiling float used in Argo. All work in a similar\nfashion but differ somewhat in their design characteristics. At typically\n10-day intervals, the floats pump fluid into an external bladder and rise\nto the surface over about 6 hours while measuring temperature and salinity.\nSatellites or GPS determine the position of the floats when they surface,\nand the floats transmit their data to the satellites. The bladder then\ndeflates and the float returns to its original density and sinks to drift\nuntil the cycle is repeated. Floats are designed to make about 150 such\ncycles.\nData Management URL: http://www.argodatamgt.org/Documentation"
ArgoFloats-synthetic-BGC,public,Argo,table,TrajectoryProfile,EDDTableFromMultidimNcFiles,Argo float synthetic vertical profiles : BGC data,-999.999,181.706,,-99.999,82.99017,,,,2002-09-08T23:02:51Z,2024-08-20T08:33:20Z,,,https://erddap.ifremer.fr/erddap/tabledap/ArgoFloats-synthetic-BGC.subset,https://erddap.ifremer.fr/erddap/tabledap/ArgoFloats-synthetic-BGC,https://erddap.ifremer.fr/erddap/tabledap/ArgoFloats-synthetic-BGC.graph,,,,,https://erddap.ifremer.fr/erddap/metadata/fgdc/xml/ArgoFloats-synthetic-BGC_fgdc.xml,https://erddap.ifremer.fr/erddap/metadata/iso19115/xml/ArgoFloats-synthetic-BGC_iso19115.xml,https://erddap.ifremer.fr/erddap/info/ArgoFloats-synthetic-BGC/index,(local files),http://www.argodatamgt.org/Documentation,https://erddap.ifremer.fr/erddap/rss/ArgoFloats-synthetic-BGC.rss,https://erddap.ifremer.fr/erddap/subscriptions/add.html?datasetID=ArgoFloats-synthetic-BGC&showErrors=false&email=,now-5days,1.1984909,Argo float synthetic vertical profiles : BGC data
ArgoFloats-reference,public,Argo,table,Other,EDDTableFromMultidimNcFiles,Argo Reference Measurements,-180.0,179.99948666666666,,-77.44,82.79761333333333,,,,1998-08-05T07:52:42Z,2022-09-20T03:36:32Z,,,,https://erddap.ifremer.fr/erddap/tabledap/ArgoFloats-reference,https://erddap.ifremer.fr/erddap/tabledap/ArgoFloats-reference.graph,,,,,https://erddap.ifremer.fr/erddap/metadata/fgdc/xml/ArgoFloats-reference_fgdc.xml,https://erddap.ifremer.fr/erddap/metadata/iso19115/xml/ArgoFloats-reference_iso19115.xml,https://erddap.ifremer.fr/erddap/info/ArgoFloats-reference/index,(local files),http://www.argodatamgt.org/DMQC/Reference-data-base,https://erddap.ifremer.fr/erddap/rss/ArgoFloats-reference.rss,https://erddap.ifremer.fr/erddap/subscriptions/add.html?datasetID=ArgoFloats-reference&showErrors=false&email=,,,Argo float vertical profiles to be used in DMQC. The free-moving nature of profiling floats means that most float measurements are without accompanying in-situ ground truth values for absolute calibration (such as those afforded by shipboard CTD measurements). Therefore Argo delayed-mode procedures for checking sensor drifts and offsets in salinity rely on reference datasets and statistical methods. Dataset assembled by John Gilson (SCRIPPS)
ArgoFloats-index,public,Argo,table,Other,EDDTableFromAsciiFiles,ArgoFloats index,-999.999,346.813,,-99.999,89.971,,,,,,,,https://erddap.ifremer.fr/erddap/tabledap/ArgoFloats-index.subset,https://erddap.ifremer.fr/erddap/tabledap/ArgoFloats-index,https://erddap.ifremer.fr/erddap/tabledap/ArgoFloats-index.graph,,,,,https://erddap.ifremer.fr/erddap/metadata/fgdc/xml/ArgoFloats-index_fgdc.xml,https://erddap.ifremer.fr/erddap/metadata/iso19115/xml/ArgoFloats-index_iso19115.xml,https://erddap.ifremer.fr/erddap/info/ArgoFloats-index/index,ftp://ftp.ifremer.fr/ifremer/argo/ar_index_global_prof.txt,http://www.argodatamgt.org/DMQC/Reference-data-base,https://erddap.ifremer.fr/erddap/rss/ArgoFloats-index.rss,https://erddap.ifremer.fr/erddap/subscriptions/add.html?datasetID=ArgoFloats-index&showErrors=false&email=,,,Argo detailed index. Gathers data available at ftp://ftp.ifremer.fr/ifremer/argo/ar_index_global_prof.txt
ArgoFloats-reference-CTD,log in,Argo,table,Other,EDDTableFromMultidimNcFiles,CTD Reference Measurements,,,,,,,,,,,,,,,,,,,,,,,,,,,,,"Conductivity, Temperature, Depth (CTD) Reference Measurements. Argo data from a local source."
SST_Anomalies_Caledonie,public,Jet Propulsion Laboratory,grid,Grid,EDDGridFromNcFiles,"Daily MUR SST, Final product",155.01,175.01,0.01,-27.0,-14.01,0.01,,,2014-01-16T09:00:00Z,2021-12-16T09:00:00Z,2629288.4210526315,https://erddap.ifremer.fr/erddap/griddap/SST_Anomalies_Caledonie,,,https://erddap.ifremer.fr/erddap/griddap/SST_Anomalies_Caledonie.graph,,,https://erddap.ifremer.fr/erddap/wms/SST_Anomalies_Caledonie/request,,https://erddap.ifremer.fr/erddap/metadata/fgdc/xml/SST_Anomalies_Caledonie_fgdc.xml,https://erddap.ifremer.fr/erddap/metadata/iso19115/xml/SST_Anomalies_Caledonie_iso19115.xml,https://erddap.ifremer.fr/erddap/info/SST_Anomalies_Caledonie/index,(local files),https://podaac.jpl.nasa.gov/ws/metadata/dataset/?format=iso&shortName=MUR-JPL-L4-GLOB-v04.1,https://erddap.ifremer.fr/erddap/rss/SST_Anomalies_Caledonie.rss,https://erddap.ifremer.fr/erddap/subscriptions/add.html?datasetID=SST_Anomalies_Caledonie&showErrors=false&email=,now-109days,9.027284,"A merged, multi-sensor L4 Foundation Sea Surface Temperature (SST) analysis product from Jet Propulsion Laboratory (JPL)."
OS_DYFAMED_1994-2014_D_TSO2,public,IMEV Villefranche-sur-mer,grid,Profile,EDDGridFromNcFiles,"EMSO Ligure DYFAMED Time Series from 1994 to 2014 (43\u00b025N, 7\u00b052E)",,,,,,,,,1994-04-08T12:07:47Z,2014-12-10T12:33:20Z,3624488.5166666666,https://erddap.ifremer.fr/erddap/griddap/OS_DYFAMED_1994-2014_D_TSO2,,,https://erddap.ifremer.fr/erddap/griddap/OS_DYFAMED_1994-2014_D_TSO2.graph,,,,,,,https://erddap.ifremer.fr/erddap/info/OS_DYFAMED_1994-2014_D_TSO2/index,(local files),???,https://erddap.ifremer.fr/erddap/rss/OS_DYFAMED_1994-2014_D_TSO2.rss,https://erddap.ifremer.fr/erddap/subscriptions/add.html?datasetID=OS_DYFAMED_1994-2014_D_TSO2&showErrors=false&email=,,,"EMSO Ligure DYFAMED Time Series from 1994 to 2014 (43\u00b025N - 7\u00b052E). In the framework of the French MOOSE program, a fixed point observatory in the Ligurian Sea (so called DYFAMED) performs since 1991 physical, biogeochemical and biological observations of the water column structure. This observatory is hosted and managed by the Oceanological Observatory in Villefranche-sur-Mer (CNRS-SU)"
drifter_hourly_qc,public,NOAA Atlantic Oceanographic and Meteorological Laboratory,table,Trajectory,EDDTableFromErddap,Global Drifter Program - 1 Hour Interpolated QC Drifter Data,-180.0,180.0,,-78.30718,89.98403,,,,1987-10-02T13:00:00Z,2022-10-31T00:00:00Z,,,https://erddap.ifremer.fr/erddap/tabledap/drifter_hourly_qc.subset,https://erddap.ifremer.fr/erddap/tabledap/drifter_hourly_qc,https://erddap.ifremer.fr/erddap/tabledap/drifter_hourly_qc.graph,,,,https://erddap.ifremer.fr/erddap/files/drifter_hourly_qc/,https://erddap.ifremer.fr/erddap/metadata/fgdc/xml/drifter_hourly_qc_fgdc.xml,https://erddap.ifremer.fr/erddap/metadata/iso19115/xml/drifter_hourly_qc_iso19115.xml,https://erddap.ifremer.fr/erddap/info/drifter_hourly_qc/index,(local files),https://www.aoml.noaa.gov/phod/dac/dirall.html,https://erddap.ifremer.fr/erddap/rss/drifter_hourly_qc.rss,https://erddap.ifremer.fr/erddap/subscriptions/add.html?datasetID=drifter_hourly_qc&showErrors=false&email=,,,"Global Drifter Program hourly drifting buoy collection. Quality control interpolated (interpolation via mathematical model fitting) data. Hourly Drifter data product exists from early 2000's to present, well suited for observing smaller-scale oceanic processes. NOAA-Atlantic Oceanographic & Meteorological Laboratory (AOML) data from a local source. The hourly QC dataset is updated on a quarterly basis, i.e. every 3 months, in delayed mode, but the data processing team has experienced unforeseen setbacks. The GDP is working as quickly as possible to update the dataset. Please reference the acknowledgment attribute to cite the dataset's DOI."
drifter_6hour_qc,public,NOAA Atlantic Oceanographic and Meteorological Laboratory,table,Trajectory,EDDTableFromErddap,Global Drifter Program - 6 Hour Interpolated QC Drifter Data,-179.999,180.0,,-78.305,89.984,,,,1979-02-15T00:00:00Z,2024-01-18T18:00:00Z,,,https://erddap.ifremer.fr/erddap/tabledap/drifter_6hour_qc.subset,https://erddap.ifremer.fr/erddap/tabledap/drifter_6hour_qc,https://erddap.ifremer.fr/erddap/tabledap/drifter_6hour_qc.graph,,,,https://erddap.ifremer.fr/erddap/files/drifter_6hour_qc/,https://erddap.ifremer.fr/erddap/metadata/fgdc/xml/drifter_6hour_qc_fgdc.xml,https://erddap.ifremer.fr/erddap/metadata/iso19115/xml/drifter_6hour_qc_iso19115.xml,https://erddap.ifremer.fr/erddap/info/drifter_6hour_qc/index,(local files),https://www.aoml.noaa.gov/phod/dac/dirall.html,https://erddap.ifremer.fr/erddap/rss/drifter_6hour_qc.rss,https://erddap.ifremer.fr/erddap/subscriptions/add.html?datasetID=drifter_6hour_qc&showErrors=false&email=,,,"Global Drifter Program 6-hourly drifting buoy collection. Quality control krigged (interpolation method) data. 6-Hour Drifter data product exists from 1979 to present, well suited for observing larger-scale oceanic processes. NOAA-Atlantic Oceanographic & Meteorological Laboratory (AOML) data from a local source. The six-hourly QC dataset is updated on a quarterly basis, i.e. every 3 months, in delayed mode. Please reference the acknowledgment attribute to cite the dataset's DOI."
HF_75c7_5b60_95d8,public,AZTI; Ifremer,grid,Grid,EDDGridFromNcFiles,Global Ocean - In Situ Observation Copernicus,-3.196593,-1.203407,0.0622870625,43.32,44.58,0.0449999999999999,-0.0,-0.0,2018-12-01T00:00:00Z,2024-06-12T04:00:00Z,4337.642585551331,https://erddap.ifremer.fr/erddap/griddap/HF_75c7_5b60_95d8,,,https://erddap.ifremer.fr/erddap/griddap/HF_75c7_5b60_95d8.graph,,,https://erddap.ifremer.fr/erddap/wms/HF_75c7_5b60_95d8/request,,https://erddap.ifremer.fr/erddap/metadata/fgdc/xml/HF_75c7_5b60_95d8_fgdc.xml,https://erddap.ifremer.fr/erddap/metadata/iso19115/xml/HF_75c7_5b60_95d8_iso19115.xml,https://erddap.ifremer.fr/erddap/info/HF_75c7_5b60_95d8/index,(local files),???,https://erddap.ifremer.fr/erddap/rss/HF_75c7_5b60_95d8.rss,https://erddap.ifremer.fr/erddap/subscriptions/add.html?datasetID=HF_75c7_5b60_95d8&showErrors=false&email=,now-16days,4.6988926,The data set consists of maps of total velocity of the surface current averaged over a time interval of 1 hour around the cardinal hour. Surface ocean velocities estimated by High Frequency (HF) Radar are representative of the upper 0.3-2.5 meters of the ocean. The main objective of near real time processing is to produce the best product from available data at the time of processing. Total velocities are derived using least square fit that maps radial velocities measured from individual sites onto a cartesian grid. The final product is a map of the horizontal components of the ocean currents on a regular grid in the area of overlap of two or more radar stations.
HF_ac49_84ad_3eb6,public,UAF; ONC; CORDC - Coastal Observing Research and Development Center,grid,Grid,EDDGridFromNcFiles,Global Ocean - In Situ Observation Copernicus,-174.0982,-128.6599,0.1652301818181818,68.00918,74.0321,0.0537760714285714,-0.0,-0.0,2018-12-01T00:00:00Z,2023-01-17T13:00:00Z,14666.141555080454,https://erddap.ifremer.fr/erddap/griddap/HF_ac49_84ad_3eb6,,,https://erddap.ifremer.fr/erddap/griddap/HF_ac49_84ad_3eb6.graph,,,https://erddap.ifremer.fr/erddap/wms/HF_ac49_84ad_3eb6/request,,https://erddap.ifremer.fr/erddap/metadata/fgdc/xml/HF_ac49_84ad_3eb6_fgdc.xml,https://erddap.ifremer.fr/erddap/metadata/iso19115/xml/HF_ac49_84ad_3eb6_iso19115.xml,https://erddap.ifremer.fr/erddap/info/HF_ac49_84ad_3eb6/index,(local files),???,https://erddap.ifremer.fr/erddap/rss/HF_ac49_84ad_3eb6.rss,https://erddap.ifremer.fr/erddap/subscriptions/add.html?datasetID=HF_ac49_84ad_3eb6&showErrors=false&email=,now-16days,36.67546,Surface ocean velocities estimated from High Frequency (HF)-Radar are representative of the upper 2.4 meters of the ocean.  The main objective of near-real time processing is to produce the best product from available data at the time of processing.  Radial velocity measurements are obtained from individual radar sites through the U.S. HF-Radar Network. Hourly radial data are processed by unweighted least squares on a 6km resolution grid of the Alaskan North Slope to produce near real-time surface current maps.
copernicus-fos,public,IFREMER,table,Profile,EDDTableFromMultidimNcFiles,"Global Ocean, In Situ Observation Copernicus (Copernicus Fishing Observing System)",-179.964,177.143,,14.55658,72.8138,,48.2,-1033.8,2006-10-11T10:55:12Z,2024-04-02T16:24:15Z,,,https://erddap.ifremer.fr/erddap/tabledap/copernicus-fos.subset,https://erddap.ifremer.fr/erddap/tabledap/copernicus-fos,https://erddap.ifremer.fr/erddap/tabledap/copernicus-fos.graph,,,,https://erddap.ifremer.fr/erddap/files/copernicus-fos/,https://erddap.ifremer.fr/erddap/metadata/fgdc/xml/copernicus-fos_fgdc.xml,https://erddap.ifremer.fr/erddap/metadata/iso19115/xml/copernicus-fos_iso19115.xml,https://erddap.ifremer.fr/erddap/info/copernicus-fos/index,(local files),https://archimer.ifremer.fr/doc/00024/13500,https://erddap.ifremer.fr/erddap/rss/copernicus-fos.rss,https://erddap.ifremer.fr/erddap/subscriptions/add.html?datasetID=copernicus-fos&showErrors=false&email=,now-44days,3.310578,Global Ocean - In Situ Observation Copernicus. The Recopesca Project : a new example of participative approach to collect fisheries and in situ environmental data
ariane_trajectories_qualitative,public,IRD,table,Other,EDDTableFromMultidimNcFiles,Numerical lagrangian data issued from river sources in Indonesia (2016-2020) - Ariane trajectories qualitative,,,,,,,,,,,,,https://erddap.ifremer.fr/erddap/tabledap/ariane_trajectories_qualitative.subset,https://erddap.ifremer.fr/erddap/tabledap/ariane_trajectories_qualitative,https://erddap.ifremer.fr/erddap/tabledap/ariane_trajectories_qualitative.graph,,,,https://erddap.ifremer.fr/erddap/files/ariane_trajectories_qualitative/,,,https://erddap.ifremer.fr/erddap/info/ariane_trajectories_qualitative/index,(local files),https://doi.org/10.12770/8dea4c5c-f2c2-4771-9372-9ce60c878c49,https://erddap.ifremer.fr/erddap/rss/ariane_trajectories_qualitative.rss,https://erddap.ifremer.fr/erddap/subscriptions/add.html?datasetID=ariane_trajectories_qualitative&showErrors=false&email=,,,This file is the raw output of Ariane software.
coast_status,public,IRD,table,Other,EDDTableFromNcFiles,Numerical lagrangian data issued from river sources in Indonesia (2016-2020) - Coast status,,,,,,,,,2016-03-31T00:00:00Z,2020-05-30T00:00:00Z,,,,https://erddap.ifremer.fr/erddap/tabledap/coast_status,https://erddap.ifremer.fr/erddap/tabledap/coast_status.graph,,,,https://erddap.ifremer.fr/erddap/files/coast_status/,,,https://erddap.ifremer.fr/erddap/info/coast_status/index,(local files),https://doi.org/10.12770/8dea4c5c-f2c2-4771-9372-9ce60c878c49,https://erddap.ifremer.fr/erddap/rss/coast_status.rss,https://erddap.ifremer.fr/erddap/subscriptions/add.html?datasetID=coast_status&showErrors=false&email=,,,"This file contains time series of simulated particle status with respect to their fate (stranding, out of domain, still at sea)"
histo_coord,public,IRD,grid,TimeSeries,EDDGridFromNcFiles,Numerical lagrangian data issued from river sources in Indonesia (2016-2020) - Histo coord,90.0,144.917,0.0833338391502276,-25.0,34.91699,0.0833337830319888,,,2016-04-01T00:00:00Z,2020-05-31T00:00:00Z,86456.84210526316,https://erddap.ifremer.fr/erddap/griddap/histo_coord,,,https://erddap.ifremer.fr/erddap/griddap/histo_coord.graph,,,https://erddap.ifremer.fr/erddap/wms/histo_coord/request,https://erddap.ifremer.fr/erddap/files/histo_coord/,https://erddap.ifremer.fr/erddap/metadata/fgdc/xml/histo_coord_fgdc.xml,https://erddap.ifremer.fr/erddap/metadata/iso19115/xml/histo_coord_iso19115.xml,https://erddap.ifremer.fr/erddap/info/histo_coord/index,(local files),https://doi.org/10.12770/8dea4c5c-f2c2-4771-9372-9ce60c878c49,https://erddap.ifremer.fr/erddap/rss/histo_coord.rss,https://erddap.ifremer.fr/erddap/subscriptions/add.html?datasetID=histo_coord&showErrors=false&email=,,,This file contains time series of 2D-histogram of simulated particles (computed as the sum of particles per grid cell)
traj_lonlat_init_t0,public,IRD,grid,Trajectory,EDDGridFromNcFiles,Numerical lagrangian data issued from river sources in Indonesia (2016-2020) - Traj lonlat init t0,,,,,,,,,,,,https://erddap.ifremer.fr/erddap/griddap/traj_lonlat_init_t0,,,https://erddap.ifremer.fr/erddap/griddap/traj_lonlat_init_t0.graph,,,,https://erddap.ifremer.fr/erddap/files/traj_lonlat_init_t0/,,,https://erddap.ifremer.fr/erddap/info/traj_lonlat_init_t0/index,(local files),https://doi.org/10.12770/8dea4c5c-f2c2-4771-9372-9ce60c878c49,https://erddap.ifremer.fr/erddap/rss/traj_lonlat_init_t0.rss,https://erddap.ifremer.fr/erddap/subscriptions/add.html?datasetID=traj_lonlat_init_t0&showErrors=false&email=,,,This file contains trajectories of simulated particles in grid indices and lat/lon coordinates. The position remains unchanged once the particle is considered as stranded.
OceanGlidersGDACTrajectories,public,IFREMER,table,Trajectory,EDDTableFromNcFiles,OceanGliders GDAC trajectories,-179.9998312997277,696970.15,,-94.01332363329216,696970.15,,,,1970-01-01T00:00:00Z,2024-08-25T15:10:38Z,,,,https://erddap.ifremer.fr/erddap/tabledap/OceanGlidersGDACTrajectories,https://erddap.ifremer.fr/erddap/tabledap/OceanGlidersGDACTrajectories.graph,,,,,https://erddap.ifremer.fr/erddap/metadata/fgdc/xml/OceanGlidersGDACTrajectories_fgdc.xml,https://erddap.ifremer.fr/erddap/metadata/iso19115/xml/OceanGlidersGDACTrajectories_iso19115.xml,https://erddap.ifremer.fr/erddap/info/OceanGlidersGDACTrajectories/index,(local files),http://www.ego-network.org/,https://erddap.ifremer.fr/erddap/rss/OceanGlidersGDACTrajectories.rss,https://erddap.ifremer.fr/erddap/subscriptions/add.html?datasetID=OceanGlidersGDACTrajectories&showErrors=false&email=,,,OceanGliders GDAC trajectories
SDC_BAL_AGG_V2,public,SeaDataNet,table,Point,EDDTableFromAsciiFiles,SDC Baltic Sea Aggregation V2,8.9667,30.266,,53.8067,65.89667,,0.24,-556.0,1902-08-05T23:00:00Z,2019-06-04T09:12:29Z,,,https://erddap.ifremer.fr/erddap/tabledap/SDC_BAL_AGG_V2.subset,https://erddap.ifremer.fr/erddap/tabledap/SDC_BAL_AGG_V2,https://erddap.ifremer.fr/erddap/tabledap/SDC_BAL_AGG_V2.graph,,,,,https://erddap.ifremer.fr/erddap/metadata/fgdc/xml/SDC_BAL_AGG_V2_fgdc.xml,https://erddap.ifremer.fr/erddap/metadata/iso19115/xml/SDC_BAL_AGG_V2_iso19115.xml,https://erddap.ifremer.fr/erddap/info/SDC_BAL_AGG_V2/index,(local files),???,https://erddap.ifremer.fr/erddap/rss/SDC_BAL_AGG_V2.rss,https://erddap.ifremer.fr/erddap/subscriptions/add.html?datasetID=SDC_BAL_AGG_V2&showErrors=false&email=,,,Data from a local source.
SDC_BLS_AGG_V2,public,SeaDataNet,table,Point,EDDTableFromAsciiFiles,SDC Black Sea Aggregation V2,27.4546,41.793,,40.9188,47.2,,0.99221,-2208.0,,2019-06-02T12:07:00Z,,,https://erddap.ifremer.fr/erddap/tabledap/SDC_BLS_AGG_V2.subset,https://erddap.ifremer.fr/erddap/tabledap/SDC_BLS_AGG_V2,https://erddap.ifremer.fr/erddap/tabledap/SDC_BLS_AGG_V2.graph,,,,,https://erddap.ifremer.fr/erddap/metadata/fgdc/xml/SDC_BLS_AGG_V2_fgdc.xml,https://erddap.ifremer.fr/erddap/metadata/iso19115/xml/SDC_BLS_AGG_V2_iso19115.xml,https://erddap.ifremer.fr/erddap/info/SDC_BLS_AGG_V2/index,(local files),???,https://erddap.ifremer.fr/erddap/rss/SDC_BLS_AGG_V2.rss,https://erddap.ifremer.fr/erddap/subscriptions/add.html?datasetID=SDC_BLS_AGG_V2&showErrors=false&email=,,,Data from a local source.
SDC_GLO_AGG_V2,public,SeaDataNet,table,Point,EDDTableFromAsciiFiles,SDC Global Ocean Aggregation V2,-97.1137,41.793,,9.37043,76.45,,3283.04761,-7959.866209999999,,2019-09-22T11:44:00Z,,,https://erddap.ifremer.fr/erddap/tabledap/SDC_GLO_AGG_V2.subset,https://erddap.ifremer.fr/erddap/tabledap/SDC_GLO_AGG_V2,https://erddap.ifremer.fr/erddap/tabledap/SDC_GLO_AGG_V2.graph,,,,,https://erddap.ifremer.fr/erddap/metadata/fgdc/xml/SDC_GLO_AGG_V2_fgdc.xml,https://erddap.ifremer.fr/erddap/metadata/iso19115/xml/SDC_GLO_AGG_V2_iso19115.xml,https://erddap.ifremer.fr/erddap/info/SDC_GLO_AGG_V2/index,(local files),???,https://erddap.ifremer.fr/erddap/rss/SDC_GLO_AGG_V2.rss,https://erddap.ifremer.fr/erddap/subscriptions/add.html?datasetID=SDC_GLO_AGG_V2&showErrors=false&email=,,,Data from a local source.
SDC_MED_AGG_V2,public,SeaDataNet,table,Point,EDDTableFromAsciiFiles,SDC Mediterranean Sea Aggregation V2,-9.2919,36.1953,,30.505,45.76133,,3.17745,-7959.866209999999,1911-08-17T09:24:00Z,2019-09-22T11:44:00Z,,,https://erddap.ifremer.fr/erddap/tabledap/SDC_MED_AGG_V2.subset,https://erddap.ifremer.fr/erddap/tabledap/SDC_MED_AGG_V2,https://erddap.ifremer.fr/erddap/tabledap/SDC_MED_AGG_V2.graph,,,,,https://erddap.ifremer.fr/erddap/metadata/fgdc/xml/SDC_MED_AGG_V2_fgdc.xml,https://erddap.ifremer.fr/erddap/metadata/iso19115/xml/SDC_MED_AGG_V2_iso19115.xml,https://erddap.ifremer.fr/erddap/info/SDC_MED_AGG_V2/index,(local files),???,https://erddap.ifremer.fr/erddap/rss/SDC_MED_AGG_V2.rss,https://erddap.ifremer.fr/erddap/subscriptions/add.html?datasetID=SDC_MED_AGG_V2&showErrors=false&email=,,,Data from a local source.
SDC_NATL_AGG_V2,public,SeaDataNet,table,Point,EDDTableFromAsciiFiles,SDC North Atlantic Aggregation V2,-97.1137,-0.54916,,9.37043,76.45,,3283.04761,-6456.2998,1893-08-10T04:45:00Z,2019-06-04T08:10:41Z,,,https://erddap.ifremer.fr/erddap/tabledap/SDC_NATL_AGG_V2.subset,https://erddap.ifremer.fr/erddap/tabledap/SDC_NATL_AGG_V2,https://erddap.ifremer.fr/erddap/tabledap/SDC_NATL_AGG_V2.graph,,,,,https://erddap.ifremer.fr/erddap/metadata/fgdc/xml/SDC_NATL_AGG_V2_fgdc.xml,https://erddap.ifremer.fr/erddap/metadata/iso19115/xml/SDC_NATL_AGG_V2_iso19115.xml,https://erddap.ifremer.fr/erddap/info/SDC_NATL_AGG_V2/index,(local files),???,https://erddap.ifremer.fr/erddap/rss/SDC_NATL_AGG_V2.rss,https://erddap.ifremer.fr/erddap/subscriptions/add.html?datasetID=SDC_NATL_AGG_V2&showErrors=false&email=,,,Data from a local source.
